{
  "schema_version": "brief.v1",
  "user_id": "usr_demo0001",
  "scheduled_for": "2026-08-02T12:00:00Z",
  "staleness": {
    "digest_as_of": "2026-08-01T09:14:00Z",
    "hours_stale": 2.8,
    "warn": false,
    "message": null
  },
  "items": [
    {
      "contact_id": "h_8f21a4c0",
      "display": "Maya",
      "headline": "Maya asked you something 12 days ago",
      "gist": "asked if you're still coming on the 14th, needs an answer by Friday",
      "remedy": "reply",
      "drafts": {
        "schema_version": "draft_bundle.v1",
        "contact_id": "h_8f21a4c0",
        "gist_id": "g_11aa22bb",
        "candidates": [
          {
            "stance": "answer",
            "text": "sorry been mia — yes im still coming on the 14th, book it",
            "chars": 56
          },
          {
            "stance": "defer",
            "text": "sorry been mia, been slammed. still figuring out the 14th, can i tell u by tmrw",
            "chars": 78
          }
        ],
        "model_id": "gemini-2.5-flash-lite",
        "prompt_version": "draft.v1",
        "voice_pack_version": "vp_4a91cc02",
        "validator": {
          "passed": true,
          "attempts": 1,
          "failures": []
        },
        "latency_ms": 740,
        "as_of": "2026-08-01T09:14:00Z"
      }
    },
    {
      "contact_id": "h_3c77e910",
      "display": "Yu",
      "headline": "Yu used to reply in 16 seconds. It's been 51 days.",
      "gist": "used to reply in 16 seconds; 51 days quiet and you sent the last message",
      "remedy": "call",
      "drafts": null
    },
    {
      "contact_id": "h_ba0192df",
      "display": "Mom",
      "headline": "Mom opens two of every three conversations",
      "gist": "she started the last four; your median reply to her is slower than to anyone",
      "remedy": "call",
      "drafts": null
    }
  ],
  "card_url": null
}
